<?xml version="1.0" encoding="utf-8"?>
<freemarker-doc-process-config
	xmlns="https://freemarkerdocprocess.fugerit.org"
	xmlns:xsi="http://www.w3.org/2001/XMLSchema-instance"
    xsi:schemaLocation="https://freemarkerdocprocess.fugerit.org https://www.fugerit.org/data/java/doc/xsd/freemarker-doc-process-1-0.xsd" > 	

	<!--
		Configuration stub version : 003 (2023-07-19)
	-->

	<docChain id="shared">
		<chainStep stepType="config">
			<config
				id="FJ_DOC_LIB_AUTODOC"
				class="org.fugerit.java.doc.lib.autodoc.AutodocModule"
				exception-handler="RETHROW_HANDLER"
				fallback-on-null-loop-variable="false"
				log-exception="false"
				mode="class"
				path="/fj_doc_lib_autodoc/template/"
				version="2.3.29"
				wrap-unchecked-exceptions="true"
			/>
		</chainStep>
		<chainStep stepType="function">
			<function name="annotationAsSingleStringFun" value="org.fugerit.java.doc.lib.autodoc.fun.AnnotationAsSingleStringFun"/>
			<function name="messageFormat" value="org.fugerit.java.doc.freemarker.fun.SimpleMessageFun"/>
		</chainStep>
	</docChain>

	<docChain id="autodoc" parent="shared">
		<chainStep stepType="complex" map-atts="autodocModel" template-path="${chainId}.ftl"/>
	</docChain>

	<docChain id="autodoc_schema" parent="shared">
		<chainStep stepType="complex" map-all="true" template-path="${chainId}.ftl"/>
	</docChain>

	<docChain id="autodoc_detail" parent="shared">
		<chainStep stepType="complex" map-atts="autodocDetailModel" template-path="${chainId}.ftl"/>
	</docChain>

	<docChain id="autodoc_meta" parent="shared">
		<chainStep stepType="complex" map-atts="autodocMetaModel" template-path="${chainId}.ftl"/>
	</docChain>
		
</freemarker-doc-process-config>