<?xml version="1.0" encoding="utf-8"?>
<freemarker-doc-process-config
	xmlns="https://freemarkerdocprocess.fugerit.org"
	xmlns:xsi="http://www.w3.org/2001/XMLSchema-instance"
    xsi:schemaLocation="https://freemarkerdocprocess.fugerit.org https://www.fugerit.org/data/java/doc/xsd/freemarker-doc-process-1-0.xsd" >

	<docHandlerConfig registerById="true">

		<!-- Type handler for markdown format -->
		<docHandler id="md-ext" info="md" type="org.fugerit.java.doc.base.typehandler.markdown.SimpleMarkdownExtTypeHandler" />
		<!-- Type henalder for xml format, generates the source xml:doc -->
		<docHandler id="xml-doc" info="xml" type="org.fugerit.java.doc.base.config.DocTypeHandlerXMLUTF8" />

		<!-- Type handlers for html using freemarker -->
		<docHandler id="html-fm" info="html" type="org.fugerit.java.doc.freemarker.html.FreeMarkerHtmlTypeHandlerEscapeUTF8" />
		<!-- Type handlers for html using freemarker (fragment version, only generates body content no html or head part -->
		<docHandler id="html-fragment-fm" info="fhtml" type="org.fugerit.java.doc.freemarker.html.FreeMarkerHtmlFragmentTypeHandlerEscapeUTF8" />

		<!-- Type handlers for asciidoc using freemarker -->
		<docHandler id="asoc-fm" info="asoc" type="org.fugerit.java.doc.freemarker.asciidoc.FreeMarkerAsciidocTypeHandlerUTF8" />

		<!-- Simple default PDF FOP Type handler with no added configuration   -->
		<docHandler id="pdf-fop" info="pdf" type="org.fugerit.java.doc.mod.fop.PdfFopTypeHandler" unsafe="true" unsafeMode="log-message"/>

		<!-- XLSX type hanlder  -->
		<docHandler id="xlsx-poi" info="xlsx" type="org.fugerit.java.doc.mod.poi.XlsxPoiTypeHandler" unsafe="true" unsafeMode="log-message"/>

		<!-- CSV type hanlder  -->
		<docHandler id="csv-opencsv" info="csv" type="org.fugerit.java.doc.mod.opencsv.OpenCSVTypeHandler" unsafe="true" unsafeMode="log-message"/>

	</docHandlerConfig>

	<docChain id="base-freemarker">
		<chainStep stepType="config">
			<config id="FJDOC_MOD_FREEMARKER_HTML_CONFIG" 
				version="2.3.29"
				path="/fj_doc_freemarker_config/template/"
				mode="class" 
				class="org.fugerit.java.doc.freemarker.process.DocChainModel"
				exception-handler="RETHROW_HANDLER"
				log-exception="false"
				wrap-unchecked-exceptions="true"
				fallback-on-null-loop-variable="false"/>
		</chainStep>
	</docChain>

	<docChain id="base-freemarker-html" parent="base-freemarker">
		<chainStep stepType="map">
			<map name="docBase" value="docBase"/>
			<map name="docType" value="docType"/>
			<map name="escapeTextAsHtml" value="escapeTextAsHtml"/>
		</chainStep>
	</docChain>

	<docChain id="html-freemarker" parent="base-freemarker-html">
		<chainStep stepType="complex" template-path="html_doc.ftl"/>
	</docChain>
		
	<docChain id="html-fragment-freemarker" parent="base-freemarker-html">
		<chainStep stepType="complex" template-path="html_fragment.ftl"/>
	</docChain>

	<docChain id="freemarker-doc-process-config-stub" parent="base-freemarker">
		<chainStep stepType="map">
			<map name="stubParams" value="stubParams"/>
			<map name="configModel" value="configModel"/>
		</chainStep>
		<chainStep stepType="complex" template-path="freemarker-doc-process-config-stub.ftl"/>
	</docChain>

	<docChain id="freemarker-verify-syntax-report" parent="base-freemarker">
		<chainStep stepType="complex" map-all="1" template-path="${chainId}.ftl"/>
	</docChain>

	<docChain id="asciidoc" parent="base-freemarker-html">
		<chainStep stepType="complex" template-path="asciidoc.ftl"/>
	</docChain>

</freemarker-doc-process-config>
