<?xml version="1.0" encoding="utf-8"?>
<freemarker-doc-process-config
	xmlns="https://freemarkerdocprocess.fugerit.org"
	xmlns:xsi="http://www.w3.org/2001/XMLSchema-instance"
    xsi:schemaLocation="https://freemarkerdocprocess.fugerit.org https://www.fugerit.org/data/java/doc/xsd/freemarker-doc-process-1-0.xsd" > 	

	<docHandlerConfig registerById="true" allowDuplicatedId="true">
		<docHandler id="pdf-a-ua-fop" info="pdf" type="org.fugerit.java.doc.mod.fop.PdfFopTypeHandler">
			<docHandlerCustomConfig charset="UTF-8"
									fop-config-mode="classloader"
									fop-config-classloader-path="fop-config-pdf-a-ua.xml"
									pdf-a-mode="PDF/A-1b"
									pdf-ua-mode="PDF/UA-1"/>
		</docHandler>
	</docHandlerConfig>

	<docChain id="shared">
		<chainStep stepType="config">
			<config id="FJ_SAMPLE_TEST_PDF_A_UA" version="2.3.33" path="/free_marker/"/>
		</chainStep>
		<chainStep stepType="function">
			<function name="messageFormat" value="org.fugerit.java.doc.freemarker.fun.SimpleMessageFun"/>
			<function name="sumLong" value="org.fugerit.java.doc.freemarker.fun.SimpleSumLongFun"/>
		</chainStep>
		<chainStep stepType="test.org.fugerit.java.doc.sample.freemarker.TestFreeMarker01DataStep"/>
		<chainStep stepType="map">
			<map name="list" value="userList"/>
			<map name="testBase64Img" value="testBase64Img"/>
		</chainStep>
	</docChain>

	<docChain id="pdf_a_test" parent="shared">
		<chainStep stepType="complex" template-path="pdf_a_test.ftl"/>
	</docChain>

</freemarker-doc-process-config>
