<?xml version="1.0" encoding="utf-8"?>
<freemarker-doc-process-config
	xmlns="https://freemarkerdocprocess.fugerit.org"
	xmlns:xsi="http://www.w3.org/2001/XMLSchema-instance"
    xsi:schemaLocation="https://freemarkerdocprocess.fugerit.org https://www.fugerit.org/data/java/doc/xsd/freemarker-doc-process-1-0.xsd"
	validating="true"
	failOnValidate="true"
	cleanSource="false">

	<docHandlerConfig>
		<docHandler id="html-fm" info="html" type="org.fugerit.java.doc.freemarker.html.FreeMarkerHtmlTypeHandlerEscapeUTF8" />
	</docHandlerConfig>

	<docChain id="shared">
		<chainStep stepType="config">
			<config id="FJ_DOC_TEST"
				version="2.3.31"
				path="/fj_doc_test/template/"
				mode="class" 
				class="org.fugerit.java.doc.freemarker.fun.CleanXmlFun"
				exception-handler="RETHROW_HANDLER"
				log-exception="false"
				wrap-unchecked-exceptions="true"
				fallback-on-null-loop-variable="false"
				load-bundled-functions="true"/>
		</chainStep>
	</docChain>

	<docChain id="sample_chain" parent="shared">
		<chainStep stepType="complex" template-path="${chainId}.ftl"/>
	</docChain>

	<docChain id="error_chain" parent="shared">
		<chainStep stepType="complex" template-path="${chainId}.ftl"/>
	</docChain>

</freemarker-doc-process-config>
